{
  "action": "allow",
  "actor_role": "implementation",
  "allowed": true,
  "breached_limits": [],
  "command_id": "phase-PROOF-P01-a1-proof",
  "decided_at": "2026-08-10T05:41:47Z",
  "decision_digest": "485b63155867980a7dd24d5a58d5ffde4798cc4cabb8bd1261b3a4cb4ffd7f14",
  "enforcement_mode": "hard",
  "evaluations": [
    {
      "action": "allow",
      "already_consumed": 0.0,
      "effective_capacity": 12.0,
      "exceeded": false,
      "limit_id": "run-provider-sessions",
      "limit_value": 12.0,
      "metric": "provider_sessions",
      "native_unit": "sessions",
      "projected": 1.0,
      "reason": "provider_sessions in sessions: 1.0 of 12.0 on run=canonical-proof-claude",
      "requested": 1.0,
      "scope_id": "canonical-proof-claude",
      "scope_kind": "run"
    }
  ],
  "policy_digest": "de62a6633327358d6865185ad4242dcf72ae7387379f2e3b05bfeec1fdbdb49d",
  "protected_reserves": [],
  "reason": "within all applicable limits",
  "requests": [
    {
      "amount": 1.0,
      "metric": "provider_sessions",
      "native_unit": "sessions"
    }
  ],
  "run_id": "canonical-proof-claude",
  "schema_version": "1.0",
  "scopes": {
    "run": "canonical-proof-claude"
  }
}
