{
  "action": "allow",
  "actor_role": "implementation",
  "allowed": true,
  "breached_limits": [],
  "command_id": "job-perm-adapter-live-codex",
  "decided_at": "2026-08-10T04:59:30Z",
  "decision_digest": "af787a1f54c2824e68990ae20fd2a9fa9b4375258e32aa0a280c5eb12f08b0b9",
  "enforcement_mode": "hard",
  "evaluations": [
    {
      "action": "allow",
      "already_consumed": 0.0,
      "effective_capacity": 12.0,
      "exceeded": false,
      "limit_id": "run-provider-sessions",
      "limit_value": 12.0,
      "metric": "provider_sessions",
      "native_unit": "sessions",
      "projected": 1.0,
      "reason": "provider_sessions in sessions: 1.0 of 12.0 on run=perm-adapter-live-codex",
      "requested": 1.0,
      "scope_id": "perm-adapter-live-codex",
      "scope_kind": "run"
    }
  ],
  "policy_digest": "99ea3f41d3a406cc3f337ba5538fea1386fc7a3d55baa87f33edfd8ef0a551ee",
  "protected_reserves": [],
  "reason": "within all applicable limits",
  "requests": [
    {
      "amount": 1.0,
      "metric": "provider_sessions",
      "native_unit": "sessions"
    }
  ],
  "run_id": "perm-adapter-live-codex",
  "schema_version": "1.0",
  "scopes": {
    "run": "perm-adapter-live-codex"
  }
}
