{
  "action": "allow",
  "actor_role": "implementation",
  "allowed": true,
  "breached_limits": [],
  "command_id": "job-perm-adapter-live-claude",
  "decided_at": "2026-08-10T04:59:16Z",
  "decision_digest": "b835162e037c035cdb46000ee90d32148d5e1b10e6c75601f45342cba57f93fd",
  "enforcement_mode": "hard",
  "evaluations": [
    {
      "action": "allow",
      "already_consumed": 0.0,
      "effective_capacity": 12.0,
      "exceeded": false,
      "limit_id": "run-provider-sessions",
      "limit_value": 12.0,
      "metric": "provider_sessions",
      "native_unit": "sessions",
      "projected": 1.0,
      "reason": "provider_sessions in sessions: 1.0 of 12.0 on run=perm-adapter-live-claude",
      "requested": 1.0,
      "scope_id": "perm-adapter-live-claude",
      "scope_kind": "run"
    }
  ],
  "policy_digest": "344998a5c5e0918944fb3b837bf901c25e2d8bf9f0df191564bed141d3c1b56e",
  "protected_reserves": [],
  "reason": "within all applicable limits",
  "requests": [
    {
      "amount": 1.0,
      "metric": "provider_sessions",
      "native_unit": "sessions"
    }
  ],
  "run_id": "perm-adapter-live-claude",
  "schema_version": "1.0",
  "scopes": {
    "run": "perm-adapter-live-claude"
  }
}
