{
  "action": "allow",
  "actor_role": "implementation",
  "allowed": true,
  "breached_limits": [],
  "command_id": "crash-drill-cmd-1",
  "decided_at": "2026-08-10T04:21:50Z",
  "decision_digest": "ef5b6ed38774cdc4aa813c43368671fc530a1680bbe1c062fa31fca3964a7032",
  "enforcement_mode": "hard",
  "evaluations": [
    {
      "action": "allow",
      "already_consumed": 0.0,
      "effective_capacity": 12.0,
      "exceeded": false,
      "limit_id": "l1",
      "limit_value": 12.0,
      "metric": "provider_sessions",
      "native_unit": "sessions",
      "projected": 1.0,
      "reason": "provider_sessions in sessions: 1.0 of 12.0 on run=crash-drill-20260810-1",
      "requested": 1.0,
      "scope_id": "crash-drill-20260810-1",
      "scope_kind": "run"
    }
  ],
  "policy_digest": "3ee5181c4968762675ce799751b6bd6ef224ee7f1887cde94701274235a95ab6",
  "protected_reserves": [],
  "reason": "within all applicable limits",
  "requests": [
    {
      "amount": 1.0,
      "metric": "provider_sessions",
      "native_unit": "sessions"
    }
  ],
  "run_id": "crash-drill-20260810-1",
  "schema_version": "1.0",
  "scopes": {
    "run": "crash-drill-20260810-1"
  }
}
