{
  "action": "allow",
  "actor_role": "implementation",
  "allowed": true,
  "breached_limits": [],
  "command_id": "phase-PROOF4-P01-a1-proof",
  "decided_at": "2026-08-10T08:52:45Z",
  "decision_digest": "8355301a96494582d22f4141b2a2dedb3dd20633c7f63ff328418963bd78e93d",
  "enforcement_mode": "hard",
  "evaluations": [
    {
      "action": "allow",
      "already_consumed": 0.0,
      "effective_capacity": 12.0,
      "exceeded": false,
      "limit_id": "run-provider-sessions",
      "limit_value": 12.0,
      "metric": "provider_sessions",
      "native_unit": "sessions",
      "projected": 1.0,
      "reason": "provider_sessions in sessions: 1.0 of 12.0 on run=qualified-proof-claude-r4",
      "requested": 1.0,
      "scope_id": "qualified-proof-claude-r4",
      "scope_kind": "run"
    }
  ],
  "policy_digest": "3e1a0d09b13057d9bea49b6ca2e0427d63b0602bd55d0f4adfead3a91003689d",
  "protected_reserves": [],
  "reason": "within all applicable limits",
  "requests": [
    {
      "amount": 1.0,
      "metric": "provider_sessions",
      "native_unit": "sessions"
    }
  ],
  "run_id": "qualified-proof-claude-r4",
  "schema_version": "1.0",
  "scopes": {
    "run": "qualified-proof-claude-r4"
  }
}
