{
  "action": "allow",
  "actor_role": "implementation",
  "allowed": true,
  "breached_limits": [],
  "command_id": "phase-PROOF-P01-a1-proof",
  "decided_at": "2026-08-10T05:42:03Z",
  "decision_digest": "c366d6a8d81d7cb5c22a3dfef402588ac69290d2bb6890f0b2d57965e662b3b4",
  "enforcement_mode": "hard",
  "evaluations": [
    {
      "action": "allow",
      "already_consumed": 0.0,
      "effective_capacity": 12.0,
      "exceeded": false,
      "limit_id": "run-provider-sessions",
      "limit_value": 12.0,
      "metric": "provider_sessions",
      "native_unit": "sessions",
      "projected": 1.0,
      "reason": "provider_sessions in sessions: 1.0 of 12.0 on run=canonical-proof-codex",
      "requested": 1.0,
      "scope_id": "canonical-proof-codex",
      "scope_kind": "run"
    }
  ],
  "policy_digest": "5df68cf0c63a2de58b86e74c4716e0a5d4b5a054f4f7e6c83a173432d2103fd0",
  "protected_reserves": [],
  "reason": "within all applicable limits",
  "requests": [
    {
      "amount": 1.0,
      "metric": "provider_sessions",
      "native_unit": "sessions"
    }
  ],
  "run_id": "canonical-proof-codex",
  "schema_version": "1.0",
  "scopes": {
    "run": "canonical-proof-codex"
  }
}
